{
  "$schema": "../schemas/scenario.schema.json",
  "id": "empty-repo-bootstrap",
  "fixture": "empty-repo",
  "prompt": "canonical-bootstrap.txt",
  "mode": "bootstrap",
  "timeoutMs": 300000,
  "assertions": [
    "governanceDirsExist",
    "govRuleSetPresent",
    "projectIntentCreated",
    "firstSpecCreated",
    "canonicalBootstrapPromptMatchesContract",
    "noProductCodeChanges",
    "governanceSourcesReported"
  ],
  "weights": {
    "bootstrapActivation": 25,
    "noPrematureImplementation": 20,
    "governanceSourceHandling": 10
  },
  "notes": "Baseline bootstrap scenario for a repo with no governance present."
}
